Set Name,Skins
Snow Day,Snow Day Bard; Snow Day Gnar; Snow Day Graves; Snow Day Malzahar; Snow Day Singed; Snow Day Syndra; Snow Day Ziggs
Snowdown Showdown,Ambitious Elf Jinx; Bad Santa Veigar; Candy Cane Miss Fortune; Earnest Elf Tristana; Festive Maokai; Happy Elf Teemo; Mistletoe LeBlanc; Nutcracko; Old Saint Zilean; Re-Gifted Amumu; Reindeer Kog'Maw; Santa Braum; Santa Draven; Santa Gragas; Silent Night Sona; Slay Belle Katarina; Snow Bunny Nidalee; Snowmerdinger; Workshop Nunu & Willump
Winter Wonder,Frostblade Irelia; Frostfire Annie; Frozen Prince Mundo; Ice King Twitch; Poro Rider Sejuani; Snow Fawn Poppy; Snow Man Yi; Snowstorm Sivir; Winter Wonder Karma; Winter Wonder Lulu; Winter Wonder Neeko; Winter Wonder Orianna; Winter Wonder Soraka
Soul Fighter,Prestige Soul Fighter Pyke; Prestige Soul Fighter Shaco; Soul Fighter Evelynn; Soul Fighter Gwen; Soul Fighter Jhin; Soul Fighter Lux; Soul Fighter Naafiri; Soul Fighter Pyke; Soul Fighter Samira; Soul Fighter Sett; Soul Fighter Shaco; Soul Fighter Viego
Soulstealer,Soulstealer Vayne; Soulstealer Vladimir
Space Groove,Prestige Space Groove Lulu; Prestige Space Groove Nami; Space Groove Blitz & Crank; Space Groove Gragas; Space Groove Gwen; Space Groove Lissandra; Space Groove Lulu; Space Groove Lux; Space Groove Nami; Space Groove Nasus; Space Groove Nunu & Willump; Space Groove Ornn; Space Groove Rumble; Space Groove Samira; Space Groove Taric; Space Groove Teemo; Space Groove Twisted Fate
Spirit Blossom,Prestige Spirit Blossom Master Yi; Prestige Spirit Blossom Teemo; Spirit Blossom Ahri; Spirit Blossom Aphelios; Spirit Blossom Cassiopeia; Spirit Blossom Darius; Spirit Blossom Evelynn; Spirit Blossom Kindred; Spirit Blossom Lillia; Spirit Blossom Master Yi; Spirit Blossom Riven; Spirit Blossom Sett; Spirit Blossom Soraka; Spirit Blossom Syndra; Spirit Blossom Teemo; Spirit Blossom Thresh; Spirit Blossom Tristana; Spirit Blossom Vayne; Spirit Blossom Yasuo; Spirit Blossom Yone; Spirit Blossom Yorick
Spirit Guard,Spirit Guard Udyr
Star Guardian Season 1,Pajama Guardian Lulu; Pajama Guardian Lux; Star Guardian Janna; Star Guardian Jinx; Star Guardian Lulu; Star Guardian Lux; Star Guardian Poppy
Star Guardian Season 2,Pajama Guardian Ezreal; Pajama Guardian Miss Fortune; Pajama Guardian Soraka; Prestige Star Guardian Soraka; Star Guardian Ahri; Star Guardian Ezreal; Star Guardian Miss Fortune; Star Guardian Soraka; Star Guardian Syndra
Star Guardian Season 3,Prestige Star Guardian Neeko; Prestige Star Guardian Neeko (2022); Star Guardian Neeko; Star Guardian Rakan; Star Guardian Xayah; Star Guardian Zoe
Star Guardian Season 4,Prestige Star Guardian Ekko; Prestige Star Guardian Syndra; Redeemed Star Guardian Rakan; Redeemed Star Guardian Xayah; Star Guardian Akali; Star Guardian Ekko; Star Guardian Kai'Sa; Star Guardian Nilah; Star Guardian Orianna; Star Guardian Quinn; Star Guardian Rell; Star Guardian Senna; Star Guardian Seraphine; Star Guardian Sona; Star Guardian Taliyah; Star Nemesis Fiddlesticks; Star Nemesis Morgana
Astronauts,Astronaut Bard; Astronaut Corki; Astronaut Fizz; Astronaut Gnar; Astronaut Ivern; Astronaut Kennen; Astronaut Maokai; Astronaut Poppy; Astronaut Rammus; Astronaut Singed; Astronaut Teemo; Astronaut Veigar; Astronaut Xerath; AstroNautilus
Invaders,Alien Invader Heimerdinger; UFO Corki
Highstakes,Ace of Spades Ezreal; Jack of Hearts Twisted Fate; King of Clubs Mordekaiser; Queen of Diamonds Syndra; Wild Card Shaco
Storybook,Annie in Wonderland; Big Bad Warwick; Caterpillar Kog'Maw; Count Vladimir; Mad Hatter Shaco; Red Riding Annie
Mythmaker,Mythmaker Galio; Mythmaker Garen; Mythmaker Irelia; Mythmaker Jarvan IV; Mythmaker Jhin; Mythmaker Nami; Mythmaker Sivir; Mythmaker Zyra; Prestige Mythmaker Cassiopeia; Prestige Mythmaker Sivir
La Ilusión,La Ilusión Draven; La Ilusión Gnar; La Ilusión Nidalee; La Ilusión Qiyana; La Ilusión Renata Glasc; La Ilusión Ziggs; Prestige La Ilusión Renata Glasc
Sugar Rush,Bittersweet Lulu; Candy King Ivern; Dark Candy Fiddlesticks; Lollipoppy; Sugar Rush Braum; Sugar Rush Evelynn; Sugar Rush Ziggs; Sugar Rush Zilean
Ocean Song,Ocean Song Ashe; Ocean Song Nidalee; Ocean Song Seraphine; Ocean Song Yone; Ocean Song Zeri; Prestige Ocean Song Seraphine
Pool Party,Pool Party Braum; Pool Party Caitlyn; Pool Party Draven; Pool Party Fiora; Pool Party Gangplank; Pool Party Graves; Pool Party Heimerdinger; Pool Party Jarvan IV; Pool Party Lee Sin; Pool Party Leona; Pool Party Lulu; Pool Party Miss Fortune; Pool Party Orianna; Pool Party Rek'Sai; Pool Party Renekton; Pool Party Sett; Pool Party Syndra; Pool Party Taliyah; Pool Party Taric; Pool Party Zac; Pool Party Ziggs; Pool Party Zoe; Pool Party Mundo; Surfer Singed
Super Galaxy,Super Galaxy Annie; Super Galaxy Elise; Super Galaxy Fizz; Super Galaxy Gnar; Super Galaxy Kindred; Super Galaxy Nidalee; Super Galaxy Rumble; Super Galaxy Shyvana
Masked Justice,Masked Justice Lucian; Masked Justice Senna; Masked Justice Yone
Bewitching,Bewitching Cassiopeia; Bewitching Elise; Bewitching Fiora; Bewitching Janna; Bewitching LeBlanc; Bewitching Miss Fortune; Bewitching Morgana; Bewitching Nami; Bewitching Neeko; Bewitching Nidalee; Bewitching Poppy; Bewitching Senna; Bewitching Syndra; Bewitching Tristana; Bewitching Yuumi; Bewitching Batnivia; Prestige Bewitching Miss Fortune; Prestige Bewitching Morgana; Prestige Bewitching Miss Fortune (2022)
Trick-or-Treat,Butcher Urgot; Count Kassadin; Count Kledula; FrankenTibbers Annie; Grim Reaper Karthus; Haunted Maokai; Haunted Zyra; Haunting Nocturne; Headless Hecarim; Kitty Cat Katarina; Mundo Mundo; Nightmare Tryndamere; Nosferatu Vladimir; Pumpkin Prince Amumu; Pumpkinhead Fiddlesticks; Ravenborn LeBlanc; Spooky Gangplank; Trick or Treat Ekko; Underworld Twisted Fate; Vindicator Vayne; Wicked Lulu; Witch's Brew Blitzcrank
Winterblessed,Prestige Winterblessed Camille; Prestige Winterblessed Warwick; Winterblessed Annie; Winterblessed Camille; Winterblessed Diana; Winterblessed Hecarim; Winterblessed Hwei; Winterblessed Lucian; Winterblessed Senna; Winterblessed Shaco; Winterblessed Swain; Winterblessed Sylas; Winterblessed Thresh; Winterblessed Warwick; Winterblessed Zilean; Winterblessed Zoe
Riot,Riot Blitzcrank; Riot Graves; Riot Kayle; Riot Girl Tristana; Riot K-9 Nasus; Riot Squad Singed
Cops and Robbers,Captain Volibear; Constable Trundle; Officer Caitlyn; Officer Vi; Pickpocket Twitch; Safecracker Evelynn; Secret Agent Miss Fortune; Secret Agent Xin Zhao
Day Job,Almost-Prom King Amumu; Angler Jax; Attorney Azir; Aviator Irelia; Battle Bunny Riven; Black Belt Udyr; Boom Boom Blitzcrank; Brolaf; Corporate Mundo; Firefighter Tristana; Fisherman Fizz; Forecast Janna; French Maid Nidalee; Groovy Zilean; Hazmat Heimerdinger; Janitor Thresh; Jurassic Cho'Gath; Jurassic Kog'Maw; Lil' Slugger Trundle; Lumberjack Sion; Matador Alistar; Prestigious LeBlanc; Primetime Draven; Prom Queen Annie; Sailor Gangplank; Scuba Gragas
Dunkmaster,Dunkmaster Darius; Dunkmaster Ivern
High Society,Archduke Nasus; Aristocrat Vayne; Gentleman Cho'Gath; Gentleman Gnar; Marquis Vladimir; Order of the Banana Soraka; Tango Evelynn; Tango Twisted Fate
Luchador,El León Gnar; El Macho Mundo; El Rayo Volibear; El Tigre Braum
Mad Scientists,Mad Scientist Singed; Mad Scientist Ziggs; Prototype Viktor; Sad Robot Amumu; Time Machine Zilean
Rift Hospital,Kennen M.D.; Nurse Akali; Surgeon Shen
Soccer Cup,All-star Akali; Goalkeeper Blitzcrank; Goalkeeper Maokai; Playmaker Lee Sin; Red Card Katarina; Red Card Twisted Fate; Striker Ezreal; Striker Lucian; Superfan Gragas; Sweeper Alistar; Sweeper Rammus
Surprise Party,Annie-Versary; Surprise Party Amumu; Surprise Party Fiddlesticks
Urf the Manatee,Urf Kench; Urf the Manatee; Urf the Nami-tee; Urfrider Corki; Urfwick
Ruined,Gangplank the Betrayer; Prestige Ascended Pantheon; Ruined Draven; Ruined Karma; Ruined Miss Fortune; Ruined Pantheon; Ruined Shyvana; Sea Dog Yasuo; Unbound Thresh
Sentinels of Light,Sentinel Diana; Sentinel Graves; Sentinel Irelia; Sentinel Olaf; Sentinel Pyke; Sentinel Rengar; Sentinel Riven; Sentinel Vayne
Thunder Lord,Thunder Lord Ornn; Thunder Lord Volibear
Toy Box,Choo-Choo Ornn; Dino Gnar; Grungy Nunu & Willump; Moo Cow Alistar; Pug'Maw; Ragdoll Poppy; Renektoy; Sewn Chaos Orianna; Toy Soldier Gangplank; Toy Terror Cho'Gath
Triumphant,Triumphant Ryze
Battle of the God-Kings,Divine God-King Darius; Fallen God-King Garen; God-King Darius; God-King Garen
Nightbringer and Dawnbringer,Dawnbringer Karma; Dawnbringer Morgana; Dawnbringer Nidalee; Dawnbringer Renekton; Dawnbringer Riven; Dawnbringer Soraka; Dawnbringer Vayne; Dawnbringer Vex; Dawnbringer Yone; Genesis Nightbringer Yasuo; Nightbringer Aphelios; Nightbringer Jarvan IV; Nightbringer Kayn; Nightbringer Lee Sin; Nightbringer Lillia; Nightbringer Nasus; Nightbringer Soraka; Nightbringer Tryndamere; Nightbringer Vladimir; Nightbringer Yasuo; Prestige Nightbringer Kayn; Prestige Nightbringer Lee Sin; Prestige Nightbringer Lee Sin (2022)
Victorious,Victorious Aatrox; Victorious Anivia; Victorious Blitzcrank; Victorious Elise; Victorious Graves; Victorious Janna; Victorious Jarvan IV; Victorious Kog'Maw; Victorious Lucian; Victorious Maokai; Victorious Master Yi; Victorious Morgana; Victorious Orianna; Victorious Sejuani; Victorious Sivir; Victorious Sona; Victorious Tryndamere
Commando,Commando Galio; Commando Garen; Commando Jarvan IV; Commando Lux; Commando Xin Zhao; Guerilla Tristana; Special Forces Gangplank
Omega Squad,Omega Squad Fizz; Omega Squad Teemo; Omega Squad Tristana; Omega Squad Twitch; Omega Squad Veigar
Lunar Revel: Warring Kingdoms,Dragonblade Riven; Dragonblade Talon; Warring Kingdoms Azir; Warring Kingdoms Garen; Warring Kingdoms Jarvan IV; Warring Kingdoms Katarina; Warring Kingdoms Nidalee; Warring Kingdoms Tryndamere; Warring Kingdoms Vi; Warring Kingdoms Xin Zhao
Faerie Court,Faerie Court Ezreal; Faerie Court Fiora; Faerie Court Kalista; Faerie Court Katarina; Faerie Court Lillia; Faerie Court Lux; Faerie Court Milio; Faerie Court Seraphine; Faerie Court Soraka; Faerie Court Tristana; Faerie Queen Karma; Prestige Faerie Court Katarina
Winter Sports,Curling Veigar; Festival Kassadin; Ice Toboggan Corki; Team Spirit Anivia; The Mighty Jax; Union Jack Fiddlesticks; Vancouver Amumu; Whistler Village Twitch
Woad,Battleborn Kayle; Exiled Morgana; Woad Ashe; Woad King Darius; Woad Scout Quinn
Wonders of the World,Bear Cavalry Sejuani; Bird of Prey Anivia; Dynasty Ahri; Festival Queen Anivia; Glaive Warrior Pantheon; Masked Shaco; Muay Thai Lee Sin; Myrmidon Pantheon; Oktoberfest Gragas; Outback Renekton; Panda Teemo; Shamrock Malphite; Statue of Karthus; Sultan Gangplank; Sultan Tryndamere; Uncle Ryze; Viking Tryndamere; Vizier Malzahar; Winged Hussar Xin Zhao
Worldbreaker,Spirit Fire Brand; Sun Goddess Karma; Worldbreaker Hecarim; Worldbreaker Malzahar; Worldbreaker Maokai; Worldbreaker Nasus; Worldbreaker Nautilus; Worldbreaker Sion; Worldbreaker Trundle
Albion,Blackthorn Morgana; Nottingham Ezreal; Sherwood Forest Ashe; Viridian Kayle
Medieval,Blacksmith Poppy; King Tryndamere; Little Knight Amumu; Medieval Twitch; Queen Ashe; Sir Kled; Sorceress Lux; White Mage Veigar
Zombies VS Slayers,Zombie Brand; Zombie Nunu & Willump; Zombie Ryze; Zombie Slayer Jinx; Zombie Slayer Pantheon
Heartthrobs and Heartaches,Heartache Amumu; Heartache Vi; Heartthrob Caitlyn
Fist Bumps and Festivities,Ann-Sivir-sary